{
  "schema": "artifact/plan",
  "version": 1,
  "schema_version": "1.0.0",
  "repository_baseline": "main@abc123",
  "intent_reference": "intent-20260725-001",
  "decisions": [
    {
      "id": "DEC-001",
      "statement": "Use schemas/ top-level directory",
      "rationale": "Consistent with repository conventions",
      "decided_by": "architect",
      "decided_at": "2026-07-25T08:00:00Z"
    }
  ],
  "tasks": [
    {
      "id": "T1",
      "objective": "Define portable schemas for all artifact types",
      "requirements": ["Ensure every schema has an explicit version"],
      "file_ownership": ["schemas/"],
      "forbidden_files": ["generated/"],
      "acceptance_criteria": [
        "Every schema has an explicit version",
        "Schemas are defined for all required artifact types"
      ],
      "verification": {
        "proof_kinds": ["static"],
        "dimensions": ["outcome"]
      },
      "evidence_requirements": ["schema_version_check"],
      "rollback": "Revert schema changes"
    },
    {
      "id": "T2",
      "objective": "Add positive fixtures and validation tests",
      "requirements": ["Fixtures must validate against their schema"],
      "file_ownership": ["schemas/fixtures/", "packages/cli/test/"],
      "acceptance_criteria": [
        "Positive fixtures validate against their schema",
        "Tests pass for all fixtures"
      ],
      "verification": {
        "proof_kinds": ["unit"],
        "dimensions": ["outcome"]
      },
      "evidence_requirements": ["test_output"],
      "rollback": "Revert test and fixture changes"
    }
  ],
  "completion_policy": "all_tasks"
}
