{
  "schema": "artifact/plan",
  "version": 1,
  "schema_version": "1.0.0",
  "repository_baseline": "main@a1b2c3d",
  "intent_reference": "intent-20260725-004",
  "decisions": [
    {
      "id": "DEC-001",
      "statement": "Use sales module as template for purchase module",
      "rationale": "Confirmed pattern reduces risk",
      "decided_by": "architect",
      "decided_at": "2026-07-25T13:00:00Z"
    },
    {
      "id": "DEC-002",
      "statement": "Use PostgreSQL jsonb for line items",
      "rationale": "Flexible schema for varying item attributes",
      "decided_by": "architect",
      "decided_at": "2026-07-25T13:05:00Z"
    }
  ],
  "tasks": [
    {
      "id": "T1",
      "objective": "Create purchase receipt with line items",
      "requirements": ["REQ-001"],
      "file_ownership": ["src/purchase/", "schema/"],
      "forbidden_files": ["secrets/"],
      "acceptance_criteria": [
        "Purchase receipt is created with line items and persisted"
      ],
      "verification": {
        "proof_kinds": ["unit", "integration"],
        "dimensions": ["outcome", "integration", "regression"]
      },
      "evidence_requirements": ["receipt_creation_test"],
      "rollback": "Revert schema migration and module code"
    },
    {
      "id": "T2",
      "objective": "Restrict receipt creation to authorized roles",
      "requirements": ["REQ-003"],
      "file_ownership": ["permissions/purchase.rs"],
      "acceptance_criteria": [
        "Unauthorized user cannot create purchase receipt"
      ],
      "verification": {
        "proof_kinds": ["unit", "integration"],
        "dimensions": ["allowed", "denied", "isolation"]
      },
      "evidence_requirements": ["permission_test"],
      "rollback": "Revert permission changes"
    },
    {
      "id": "T3",
      "objective": "List purchase receipts with pagination",
      "requirements": ["REQ-002"],
      "file_ownership": ["src/purchase/"],
      "acceptance_criteria": [
        "Purchase receipts are listed with pagination"
      ],
      "verification": {
        "proof_kinds": ["unit", "integration"],
        "dimensions": ["outcome", "integration"]
      },
      "evidence_requirements": ["listing_test"],
      "rollback": "Revert listing changes"
    }
  ],
  "completion_policy": "all_tasks"
}
